{
  "schemaVersion": "1.0",
  "status": "STATIC_INVENTORY_VALIDATED_NOT_QUARANTINED",
  "baseline": {
    "repository": "ton36475-lgtm/sirinx-co",
    "branch": "agent/b1-b2-command-center",
    "head": "1f05814c3e9d173e525234d69b3ce7f2d1b01a57",
    "workingTree": "DIRTY_WORKING_TREE_BYTES_PINNED_INDIVIDUALLY",
    "resourceAdmission": "HOLD_BELOW_15_GIB"
  },
  "scope": {
    "includedFamilies": [
      "rust-action-a2a-queue-readiness",
      "node-a2a-omniroute-to-telegram",
      "telegram-http-direct-helper-and-injected-gate"
    ],
    "explicitExclusions": [
      "lead-primary-record-and-analytics-writes",
      "approval-evidence-file-writes",
      "deploy-and-release-tooling",
      "database-migration-execution",
      "unrelated-service-routes"
    ],
    "claimCeiling": "DESIGNATED_B10_1_SURFACES_ACCOUNTED_ONLY"
  },
  "contractPins": {
    "refusalFixturePath": "config/agent-runtime/durable-authority-unavailable.v1.json",
    "refusalFixtureSha256": "a4ada787b015edaa2653719b06343c3803695a7df2ae6a1f635729ddb7d90614",
    "refusalSchemaPath": "schemas/agent-runtime/durable-authority-unavailable.v1.schema.json",
    "refusalSchemaSha256": "eb1d27bbfe32aaa9cd5f782262543a8b494685ab14df5a89e42386a355965533",
    "a27ManifestPath": "config/agent-runtime/action-circuits.plan-only.v1.json",
    "a27RawSha256": "b92c6152dbfa31d27a83e32f2bb567575ffabe75e558fbe7fb6776dbcdee4b01",
    "a27DomainSeparatedDigest": "b2421996825817400d31f88757843225403ed2080541812c4db889e1ffe3cbb0"
  },
  "sourcePins": [
    { "path": "crates/sirinx-control/src/lib.rs", "sha256": "c5b130eb3a37073004c9026e31c107f9f95d6eac80107111741b8a435893c4c3", "kind": "RUNTIME" },
    { "path": "crates/sirinx-control/src/main.rs", "sha256": "0d84e4709cd22c8cae9b0e862a782fcbdfab2bf52bcdbf7863390c32874f65be", "kind": "RUNTIME" },
    { "path": "crates/sirinx-a2a/src/lib.rs", "sha256": "a91df755157ad2bfa6bf1b91657696935d13f3f6c40f421e5fcc438d402a2917", "kind": "RUNTIME" },
    { "path": "crates/sirinx-store/src/postgres.rs", "sha256": "69e06950aec86c2915ac09d313f28b0fd662dd7138846cdf1b7a652096d8d8ec", "kind": "STORE" },
    { "path": "crates/sirinx-store/migrations/0002_pending_work.sql", "sha256": "4b300ffa16656890db4b2534eabdc089cd35bbf5a0cc6c50ed884dd5f0d93ef5", "kind": "MIGRATION" },
    { "path": "crates/sirinx-store/migrations/0003_control_gates.sql", "sha256": "4bd05646ea6191c30e5f25ea4c88471313f21013c478c574b29ed88b77552936", "kind": "MIGRATION" },
    { "path": "crates/sirinx-web/src/lib.rs", "sha256": "321638a84620b47881c8da17013f697a7fe1b9867ce199b933aa03e878dc71ac", "kind": "RUNTIME" },
    { "path": "services/dev-control-api/server.mjs", "sha256": "30e5a53900846c4089d462bdbddd6e99051325ee788023034d2a16ab9f0f635e", "kind": "RUNTIME" },
    { "path": "services/dev-control-api/src/a2a-sync.mjs", "sha256": "df0300f578313aaf689e6a459f80d04c20942d752c041a07c15b4db4ed873c67", "kind": "RUNTIME" },
    { "path": "services/dev-control-api/src/a2a-omniroute.mjs", "sha256": "564524e337fff6a036ed8ce74af68030abae6418a1f7d34fc758c160b5c30dfc", "kind": "RUNTIME" },
    { "path": "services/dev-control-api/src/centerbrain-hub.mjs", "sha256": "2e467cfe2209d968902700f1eb331ea61874470e47e8b5a3bd5c228870eb592e", "kind": "RUNTIME" },
    { "path": "services/dev-control-api/src/codex-autoloop.mjs", "sha256": "34646bd499dd6cdb9d7009d41dc25e8c9cca9a93a1c2691788dcaa1bd9474ad6", "kind": "RUNTIME" },
    { "path": "services/telegram-command-bot/src/index.mjs", "sha256": "e8b3fa736a307d45f77ede2ed938c29438a4281cd8848eaf774b77c4fb8ca570", "kind": "RUNTIME" },
    { "path": "services/telegram-command-bot/src/sender.mjs", "sha256": "def1a0f98425a0982bb75750be7b1ac1ccf2a91ca0d691300dd3e58dcfac7eb8", "kind": "RUNTIME" },
    { "path": "services/telegram-command-bot/src/config.mjs", "sha256": "f5c0f7bd3ba671ffd75f08ef0fe223510dae9f83714cce23b8bbdb4d12d1332d", "kind": "RUNTIME" },
    { "path": "services/telegram-command-bot/src/control-auth.mjs", "sha256": "1bd507c842c08a0b872fbf3a07377b42e3eed4908d6acb94a98e6b4897aa8607", "kind": "RUNTIME" },
    { "path": "services/telegram-command-bot/src/control-gate.mjs", "sha256": "45d618923bd49617a9aa74bf1f6844f566fd9b5db6cded3c8370abffa484fb7e", "kind": "RUNTIME" },
    { "path": "crates/sirinx-web/tests/api.rs", "sha256": "4a643bcd63d13a49df7f98e95da61e674c04e9ba6a2779eb996e7d32b7d9210d", "kind": "TEST" },
    { "path": "services/dev-control-api/src/a2a-sync.test.mjs", "sha256": "5c3f576329e66041b8b917ae2944f4d8306160f76729c1a75005cb44eb6c5cd7", "kind": "TEST" },
    { "path": "services/dev-control-api/src/a2a-omniroute.test.mjs", "sha256": "8ceca7f23e470c6d1ecb33ae29b28078d5c77aeb8d8d763a21f37e89514e70c8", "kind": "TEST" },
    { "path": "services/dev-control-api/src/centerbrain-hub.test.mjs", "sha256": "016c42fe961715681d17ed02996097723a837e7f0402b362c8fa328d7859304a", "kind": "TEST" },
    { "path": "services/dev-control-api/src/codex-autoloop.test.mjs", "sha256": "0907aee4594cbbfadc72f157eed4d7013e4fd00513ff14b1dd2d3b76ecc708e1", "kind": "TEST" },
    { "path": "services/dev-control-api/src/server-a2a-routes.test.mjs", "sha256": "40c02e84ee0f28ed20de7d69899dd6426d03d6d04d83200147e5be78ca7f5702", "kind": "TEST" },
    { "path": "services/telegram-command-bot/src/index.test.mjs", "sha256": "03e06e462eb18c7bdc7378aae9f340669b924ff0fbe6091dfab0598fcfe1ad47", "kind": "TEST" },
    { "path": "services/telegram-command-bot/src/sender.test.mjs", "sha256": "e87e2856f17d8d7ca52b5c9a0d2996282cf21056c56ac14148b0f64570ca02dd", "kind": "TEST" },
    { "path": "services/telegram-command-bot/src/config.test.mjs", "sha256": "0eff9c78f7d965e4d7e1b0ea3ada4fe5173f458290042876f5ded363dd5d0846", "kind": "TEST" },
    { "path": "services/telegram-command-bot/src/control-gate.test.mjs", "sha256": "ce66dc4c1572599e74fe1e35d8df648326b0f097b69db140f2f78b1f22951aaf", "kind": "TEST" },
    { "path": "docs/TELEGRAM_CONTROL_PLANE.md", "sha256": "5d34ea64006ae39e8fd48c72928138e58d8b240f71127d5c10d542963e4f0b60", "kind": "DOCUMENTATION" }
  ],
  "surfaces": [
    {
      "id": "rust-legacy-gate-decision",
      "layer": "RUST_CONTROL",
      "entryKind": "HTTP_ROUTE",
      "sourcePath": "crates/sirinx-control/src/lib.rs",
      "locator": "POST /api/gates/:name/decision -> decide_gate",
      "classification": "LEGACY_CONTROL_RESTRICT_ONLY",
      "effectProfiles": ["AUTHORITY_STATE_MUTATION"],
      "currentRisk": "The route writes legacy gate state and can OPEN it without migration-0007 attestation, grant consumption, replay protection, or an effect claim.",
      "currentUnsafeBehaviorPresent": true,
      "requiredBoundary": "LEGACY_HOLD_ONLY_OPEN_NONAUTHORITATIVE",
      "quarantineImplemented": false,
      "durableAuthorityAvailable": false,
      "runtimeVerified": false,
      "requiredSourceMarkers": [
        ".route(\"/api/gates/:name/decision\", post(decide_gate))",
        "async fn decide_gate(",
        "state.store.upsert_gate(&gate).await"
      ],
      "evidenceTestPath": "crates/sirinx-control/src/lib.rs",
      "requiredTestMarkers": ["async fn opening_a_gate_requires_a_ticket()"],
      "dependencies": []
    },
    {
      "id": "rust-pending-work-write",
      "layer": "RUST_CONTROL",
      "entryKind": "HTTP_ROUTE",
      "sourcePath": "crates/sirinx-control/src/lib.rs",
      "locator": "POST /api/pending-work -> add_pending",
      "classification": "SHARED_REFUSAL_REQUIRED",
      "effectProfiles": ["QUEUE_MUTATION"],
      "currentRisk": "Optional bearer is the only route boundary; Store insertion can write Postgres and trigger pg_notify without queue authority.",
      "currentUnsafeBehaviorPresent": true,
      "requiredBoundary": "SHARED_503_BEFORE_ANY_EFFECT_SEAM",
      "quarantineImplemented": false,
      "durableAuthorityAvailable": false,
      "runtimeVerified": false,
      "requiredSourceMarkers": [
        ".route(\"/api/pending-work\", get(list_pending).post(add_pending))",
        "async fn add_pending(",
        ".insert_pending_work(&item)"
      ],
      "evidenceTestPath": "crates/sirinx-control/src/lib.rs",
      "requiredTestMarkers": ["async fn pending_work_intake_roundtrip()"],
      "dependencies": []
    },
    {
      "id": "rust-action-live",
      "layer": "RUST_CONTROL",
      "entryKind": "HTTP_ROUTE",
      "sourcePath": "crates/sirinx-control/src/lib.rs",
      "locator": "POST /api/actions -> run_action",
      "classification": "SHARED_REFUSAL_REQUIRED",
      "effectProfiles": ["UNBOUND_LEGACY_ACTION"],
      "currentRisk": "An OPEN legacy gate returns executed true for an arbitrary action even though no executor, v2 grant, claim, or dispatch exists.",
      "currentUnsafeBehaviorPresent": true,
      "requiredBoundary": "SHARED_503_BEFORE_ANY_EFFECT_SEAM",
      "quarantineImplemented": false,
      "durableAuthorityAvailable": false,
      "runtimeVerified": false,
      "requiredSourceMarkers": [
        ".route(\"/api/actions\", post(run_action))",
        "async fn run_action(",
        "GateState::Open => Ok(Json(serde_json::json!({",
        "\"executed\": true"
      ],
      "evidenceTestPath": "crates/sirinx-control/src/lib.rs",
      "requiredTestMarkers": [
        "async fn opening_a_gate_requires_a_ticket()",
        "assert_eq!(body_json(res).await[\"executed\"], true);"
      ],
      "dependencies": ["rust-legacy-gate-decision"]
    },
    {
      "id": "rust-a2a-sync",
      "layer": "RUST_CONTROL",
      "entryKind": "HTTP_ROUTE",
      "sourcePath": "crates/sirinx-control/src/lib.rs",
      "locator": "POST /api/a2a/sync -> a2a_sync",
      "classification": "SHARED_REFUSAL_REQUIRED",
      "effectProfiles": ["A2A_EGRESS", "CONNECTOR_ACTIVATION", "QUEUE_READ"],
      "currentRisk": "Caller-controlled card registration occurs before the pending-work read and can expose work and peer cards without trust admission.",
      "currentUnsafeBehaviorPresent": true,
      "requiredBoundary": "SHARED_503_BEFORE_ANY_EFFECT_SEAM",
      "quarantineImplemented": false,